{"concept_registry_sha256":"a9f2e57c3fb7147aaab8a291f5ebaf130ada5abb84ae58c0ca1797bb7a3d5b6f","contract_map_sha256":"601a739c5ce8f994e4832e1e1d57973be52c2522d2c2f464ee403a73cae65c8e","framework_version":"v8.0","non_whitespace_chars":155721,"paragraph_count":3863,"route_map_sha256":"ef084b0cd98fd6de01dd40f2701b4b010f3041e83f5e38c68556e9288f2c2fd0","schema_id":"crossframe.promax.v8.source-snapshot","schema_version":1,"section_count":16,"snapshot_id":"crossframe-promax-v8-source-3186805a","source_manifest_sha256":"ab267fa7e683c411d6397a5e1addc80013a47897dd0d92543be61ba4493d05d7","source_snapshot_sha256":"3186805a3e46e1b16948a4e51d08e7693a8e0dd04aa6b4604e796266d649936c","table_count":117,"verified_at":"2026-07-23T00:00:00+08:00"}
